{
  "contractVersion": "answer-quality-visible-artifact/v1",
  "artifactId": "artifact:synthetic:iq0b-dev-mechanism-adjacent-candidate",
  "caseId": "case:synthetic:career:iq0b-dev-mechanism-adjacent",
  "topic": "career",
  "role": "candidate",
  "visibleText": "合成证据把重点放在任务目标与反馈节奏相邻出现，因此更适合用清晰的里程碑安排工作。机制和具体做法放在同一句里，避免只留下术语，也不把这种安排写成必然成功。",
  "producerClass": "human-authored-synthetic",
  "pipelineRevision": "d3ccaf4e22e9b5c43632f44d4fd27fbaa998625f",
  "rulesetRefs": [{ "id": "synthetic-evaluation-profile", "version": "iq0b-v1" }],
  "sourceArtifactDigests": [
    "sha256:a00fcc4db3a34aba3df7ff856d8f73b09f654646616c8bddcb7d793b81cbce31"
  ],
  "sanitization": {
    "syntheticInputOnly": true,
    "rawTranscriptExcluded": true,
    "rawPromptExcluded": true,
    "modelReasoningExcluded": true,
    "personalDataExcluded": true
  },
  "exclusionPolicy": [
    "no-real-birth-input",
    "no-raw-prompt",
    "no-raw-transcript",
    "no-model-reasoning",
    "no-personal-data",
    "candidate-not-accepted-reference"
  ]
}
