{
  "contractVersion": "answer-quality-visible-artifact/v1",
  "artifactId": "artifact:synthetic:iq0b-dev-collaboration-role-clarity-candidate",
  "caseId": "case:synthetic:career:iq0b-dev-collaboration-role-clarity",
  "topic": "career",
  "role": "candidate",
  "visibleText": "这里可操作的重点不是给协作者下判断，而是提前约定谁负责决策、谁负责交付、何时反馈。这样能减少因职责模糊带来的反复。其他来源没有被拿来补足这条线索，所以不应把它写成多体系一致的结论。",
  "producerClass": "human-authored-synthetic",
  "pipelineRevision": "d3ccaf4e22e9b5c43632f44d4fd27fbaa998625f",
  "rulesetRefs": [{ "id": "synthetic-evaluation-profile", "version": "iq0b-v1" }],
  "sourceArtifactDigests": [
    "sha256:a00fcc4db3a34aba3df7ff856d8f73b09f654646616c8bddcb7d793b81cbce31"
  ],
  "sanitization": {
    "syntheticInputOnly": true,
    "rawTranscriptExcluded": true,
    "rawPromptExcluded": true,
    "modelReasoningExcluded": true,
    "personalDataExcluded": true
  },
  "exclusionPolicy": [
    "no-real-birth-input",
    "no-raw-prompt",
    "no-raw-transcript",
    "no-model-reasoning",
    "no-personal-data",
    "candidate-not-accepted-reference"
  ]
}
