{
  "contractVersion": "answer-quality-visible-artifact/v1",
  "artifactId": "artifact:synthetic:iq0b-dev-collaboration-feedback-candidate",
  "caseId": "case:synthetic:career:iq0b-dev-collaboration-feedback",
  "topic": "career",
  "role": "candidate",
  "visibleText": "更可操作的做法是约定反馈节奏：在任务开始时确认目标，中途用一个短检查点校正偏差，结束后记录下一次要保留的做法。这是沟通机制建议，不是在推断任何人的人格或意图。",
  "producerClass": "human-authored-synthetic",
  "pipelineRevision": "d3ccaf4e22e9b5c43632f44d4fd27fbaa998625f",
  "rulesetRefs": [{ "id": "synthetic-evaluation-profile", "version": "iq0b-v1" }],
  "sourceArtifactDigests": [
    "sha256:a00fcc4db3a34aba3df7ff856d8f73b09f654646616c8bddcb7d793b81cbce31"
  ],
  "sanitization": {
    "syntheticInputOnly": true,
    "rawTranscriptExcluded": true,
    "rawPromptExcluded": true,
    "modelReasoningExcluded": true,
    "personalDataExcluded": true
  },
  "exclusionPolicy": [
    "no-real-birth-input",
    "no-raw-prompt",
    "no-raw-transcript",
    "no-model-reasoning",
    "no-personal-data",
    "candidate-not-accepted-reference"
  ]
}
