{
  "contractVersion": "answer-quality-visible-artifact/v1",
  "artifactId": "artifact:synthetic:iq0b-dev-direction-structured-work-candidate",
  "caseId": "case:synthetic:career:iq0b-dev-direction-structured-work",
  "topic": "career",
  "role": "candidate",
  "visibleText": "现有合成线索更支持把工作拆成可交付的小阶段：这样能让推进节奏更稳定。它不是职业结论；如果要比较具体岗位，还要核验你的技能、作品和可获得的机会。",
  "producerClass": "human-authored-synthetic",
  "pipelineRevision": "d3ccaf4e22e9b5c43632f44d4fd27fbaa998625f",
  "rulesetRefs": [{ "id": "synthetic-evaluation-profile", "version": "iq0b-v1" }],
  "sourceArtifactDigests": [
    "sha256:a00fcc4db3a34aba3df7ff856d8f73b09f654646616c8bddcb7d793b81cbce31"
  ],
  "sanitization": {
    "syntheticInputOnly": true,
    "rawTranscriptExcluded": true,
    "rawPromptExcluded": true,
    "modelReasoningExcluded": true,
    "personalDataExcluded": true
  },
  "exclusionPolicy": [
    "no-real-birth-input",
    "no-raw-prompt",
    "no-raw-transcript",
    "no-model-reasoning",
    "no-personal-data",
    "candidate-not-accepted-reference"
  ]
}
