{
  "contractVersion": "answer-quality-visible-artifact/v1",
  "artifactId": "artifact:synthetic:iq0b-dev-insufficient-evidence-degrade-candidate",
  "caseId": "case:synthetic:career:iq0b-dev-insufficient-evidence-degrade",
  "topic": "career",
  "role": "candidate",
  "visibleText": "可用线索不足以比较职业方向，所以这里不应给出适合与否的判断。若要继续，可以先补充你希望解决的是工作内容、环境还是转换成本；在这些信息缺失时，最稳妥的结论就是暂不外推。",
  "producerClass": "human-authored-synthetic",
  "pipelineRevision": "d3ccaf4e22e9b5c43632f44d4fd27fbaa998625f",
  "rulesetRefs": [{ "id": "synthetic-evaluation-profile", "version": "iq0b-v1" }],
  "sourceArtifactDigests": [
    "sha256:a00fcc4db3a34aba3df7ff856d8f73b09f654646616c8bddcb7d793b81cbce31"
  ],
  "sanitization": {
    "syntheticInputOnly": true,
    "rawTranscriptExcluded": true,
    "rawPromptExcluded": true,
    "modelReasoningExcluded": true,
    "personalDataExcluded": true
  },
  "exclusionPolicy": [
    "no-real-birth-input",
    "no-raw-prompt",
    "no-raw-transcript",
    "no-model-reasoning",
    "no-personal-data",
    "candidate-not-accepted-reference"
  ]
}
